{
  "SchemaVersion": "scene-manifest/v1",
  "asset_id": "6fc01704d4a509d5",
  "generated_at": "2026-06-16T13:18:40Z",
  "producer": {
    "tool": "scripts/build_scene_manifest.py",
    "version": "v0.7",
    "command": "python scripts/build_scene_manifest.py --asset-id 6fc01704d4a509d5"
  },
  "geometry": {
    "obj_path": "C:\\RIFT MODDING\\Assets\\Exports\\decode-nif-geometry-6fc01704d4a509d5.json\\decode-nif-geometry-mesh6.obj",
    "mesh_block": "M#6",
    "mesh_size": 325,
    "vertex_count": 128,
    "face_count": 318,
    "has_faces": true,
    "render_class": "faced",
    "obj_sha1": "a285798cc5d9b9b2e938f09284115d5d99630e8a"
  },
  "world": {
    "world_json": "C:\\RIFT MODDING\\Assets\\Assets\\build\\flythrough\\objs\\worlds\\6fc01704d4a509d5.world.json",
    "node_count": 1,
    "mesh_count": 1,
    "transform_semantics": "mesh-parent-chain",
    "coordinate_system": {
      "handedness": "right",
      "up_axis": "Y",
      "forward_axis": "-Z",
      "translation_layout": "xyz",
      "rotation_layout": "row-major-3x3",
      "scale_layout": "uniform-float",
      "trs_composition": "v_world = R * (S * v_local) + T",
      "identity_tolerance": 1e-06
    },
    "world_transform_summary": {
      "translation": [
        0,
        0,
        0
      ],
      "rotation": [
        1,
        0,
        0,
        0,
        1,
        0,
        0,
        0,
        1
      ],
      "scale": 1
    },
    "world_transform_identity": true
  },
  "materials": {
    "material_status": "textured",
    "texture_property_count": 0,
    "material_property_count": 0,
    "vertex_color_property_count": 0,
    "scanned_at": null,
    "notes": [
      "material_status=textured inferred from flythrough texture linkage (texture bindings confirmed by pipeline); not yet confirmed by NIF-level material property scan"
    ]
  },
  "textures": {
    "source": "flythrough",
    "linked_texture_count": 1,
    "linked_textures": [
      "a6ad5487_diffuse_blank.png"
    ],
    "missing_texture_count": 0,
    "placeholder_texture_count": 0
  },
  "provenance": {
    "cohort": "C:\\RIFT MODDING\\Assets\\Assets\\Exports\\discovery-plan\\cycle-2\\stage1\\cohort.json",
    "source_nif_hash": "6fc01704d4a509d5",
    "flythrough_index_entry": "C:\\RIFT MODDING\\Assets\\Assets\\build\\flythrough\\flythrough-index.json",
    "evidence_files": [
      "C:\\RIFT MODDING\\Assets\\Assets\\build\\flythrough\\objs\\worlds\\6fc01704d4a509d5.world.json",
      "C:\\RIFT MODDING\\Assets\\Assets\\Exports\\discovery-plan\\cycle-2\\stage2\\transform-examples.json",
      "C:\\RIFT MODDING\\Assets\\Assets\\Exports\\discovery-plan\\cycle-2\\stage2\\coordinate-contract.md"
    ]
  },
  "validation": {
    "schema_valid": true,
    "consumer_ready": true,
    "warnings": [],
    "errors": []
  }
}