{
  "SchemaVersion": "scene-manifest/v1",
  "asset_id": "593ea328978bde38",
  "generated_at": "2026-06-16T13:18:35Z",
  "producer": {
    "tool": "scripts/build_scene_manifest.py",
    "version": "v0.7",
    "command": "python scripts/build_scene_manifest.py --asset-id 593ea328978bde38"
  },
  "geometry": {
    "obj_path": "C:\\RIFT MODDING\\Assets\\Exports\\decode-nif-geometry-593ea328978bde38.json\\decode-nif-geometry-mesh17.obj",
    "mesh_block": "M#17",
    "mesh_size": 276,
    "vertex_count": 50,
    "face_count": 71,
    "has_faces": true,
    "render_class": "faced",
    "obj_sha1": "98fc30c6134ddc56e1623b7d8909e056342cdf9c"
  },
  "world": {
    "world_json": "C:\\RIFT MODDING\\Assets\\Assets\\build\\flythrough\\objs\\worlds\\593ea328978bde38.world.json",
    "node_count": 12,
    "mesh_count": 1,
    "transform_semantics": "mesh-parent-chain",
    "coordinate_system": {
      "handedness": "right",
      "up_axis": "Y",
      "forward_axis": "-Z",
      "translation_layout": "xyz",
      "rotation_layout": "row-major-3x3",
      "scale_layout": "uniform-float",
      "trs_composition": "v_world = R * (S * v_local) + T",
      "identity_tolerance": 1e-06
    },
    "world_transform_summary": {
      "translation": [
        -8.820713,
        0.84901184,
        -0.07588663
      ],
      "rotation": [
        -0.0014138671,
        0.9977186,
        0.06749601,
        -0.98390645,
        0.010672177,
        -0.17836525,
        -0.17867863,
        -0.06666195,
        0.9816466
      ],
      "scale": 1
    },
    "world_transform_identity": false
  },
  "materials": {
    "material_status": "textured",
    "texture_property_count": 0,
    "material_property_count": 0,
    "vertex_color_property_count": 0,
    "scanned_at": null,
    "notes": [
      "material_status=textured inferred from flythrough texture linkage (texture bindings confirmed by pipeline); not yet confirmed by NIF-level material property scan"
    ]
  },
  "textures": {
    "source": "flythrough",
    "linked_texture_count": 1,
    "linked_textures": [
      "a6ad5487_diffuse_blank.png"
    ],
    "missing_texture_count": 0,
    "placeholder_texture_count": 0
  },
  "provenance": {
    "cohort": "C:\\RIFT MODDING\\Assets\\Assets\\Exports\\discovery-plan\\cycle-2\\stage1\\cohort.json",
    "source_nif_hash": "593ea328978bde38",
    "flythrough_index_entry": "C:\\RIFT MODDING\\Assets\\Assets\\build\\flythrough\\flythrough-index.json",
    "evidence_files": [
      "C:\\RIFT MODDING\\Assets\\Assets\\build\\flythrough\\objs\\worlds\\593ea328978bde38.world.json",
      "C:\\RIFT MODDING\\Assets\\Assets\\Exports\\discovery-plan\\cycle-2\\stage2\\transform-examples.json",
      "C:\\RIFT MODDING\\Assets\\Assets\\Exports\\discovery-plan\\cycle-2\\stage2\\coordinate-contract.md"
    ]
  },
  "validation": {
    "schema_valid": true,
    "consumer_ready": true,
    "warnings": [],
    "errors": []
  }
}