{
  "SchemaVersion": "scene-manifest/v1",
  "asset_id": "4a97d66a665a538e",
  "generated_at": "2026-06-16T13:18:35Z",
  "producer": {
    "tool": "scripts/build_scene_manifest.py",
    "version": "v0.7",
    "command": "python scripts/build_scene_manifest.py --asset-id 4a97d66a665a538e"
  },
  "geometry": {
    "obj_path": "C:\\RIFT MODDING\\Assets\\Exports\\decode-nif-geometry-4a97d66a665a538e-mesh10\\decode-nif-geometry\\decode-nif-geometry-mesh10.obj",
    "mesh_block": "M#10",
    "mesh_size": 267,
    "vertex_count": 5,
    "face_count": 2,
    "has_faces": true,
    "render_class": "faced",
    "obj_sha1": "696e8315de92a0e081f00778f90b5062cdd08549"
  },
  "world": {
    "world_json": "C:\\RIFT MODDING\\Assets\\Assets\\build\\flythrough\\objs\\worlds\\4a97d66a665a538e.world.json",
    "node_count": 2,
    "mesh_count": 1,
    "transform_semantics": "mesh-parent-chain",
    "coordinate_system": {
      "handedness": "right",
      "up_axis": "Y",
      "forward_axis": "-Z",
      "translation_layout": "xyz",
      "rotation_layout": "row-major-3x3",
      "scale_layout": "uniform-float",
      "trs_composition": "v_world = R * (S * v_local) + T",
      "identity_tolerance": 1e-06
    },
    "world_transform_summary": {
      "translation": [
        0,
        0,
        0
      ],
      "rotation": [
        0.9995742,
        -0.013997357,
        -0.025590966,
        0.014168175,
        0.9998784,
        0.0065008216,
        0.02549679,
        -0.0068608923,
        0.99965113
      ],
      "scale": 1
    },
    "world_transform_identity": false
  },
  "materials": {
    "material_status": "textured",
    "texture_property_count": 0,
    "material_property_count": 0,
    "vertex_color_property_count": 0,
    "scanned_at": null,
    "notes": [
      "material_status=textured inferred from flythrough texture linkage (texture bindings confirmed by pipeline); not yet confirmed by NIF-level material property scan"
    ]
  },
  "textures": {
    "source": "flythrough",
    "linked_texture_count": 1,
    "linked_textures": [
      "fe0ade02_magma_1.png"
    ],
    "missing_texture_count": 0,
    "placeholder_texture_count": 0
  },
  "provenance": {
    "cohort": "C:\\RIFT MODDING\\Assets\\Assets\\Exports\\discovery-plan\\cycle-2\\stage1\\cohort.json",
    "source_nif_hash": "4a97d66a665a538e",
    "flythrough_index_entry": "C:\\RIFT MODDING\\Assets\\Assets\\build\\flythrough\\flythrough-index.json",
    "evidence_files": [
      "C:\\RIFT MODDING\\Assets\\Assets\\build\\flythrough\\objs\\worlds\\4a97d66a665a538e.world.json",
      "C:\\RIFT MODDING\\Assets\\Assets\\Exports\\discovery-plan\\cycle-2\\stage2\\transform-examples.json",
      "C:\\RIFT MODDING\\Assets\\Assets\\Exports\\discovery-plan\\cycle-2\\stage2\\coordinate-contract.md"
    ]
  },
  "validation": {
    "schema_valid": true,
    "consumer_ready": true,
    "warnings": [],
    "errors": []
  }
}