{
  "SchemaVersion": "scene-manifest/v1",
  "asset_id": "e3de1077a37d0337",
  "generated_at": "2026-06-16T13:18:38Z",
  "producer": {
    "tool": "scripts/build_scene_manifest.py",
    "version": "v0.7",
    "command": "python scripts/build_scene_manifest.py --asset-id e3de1077a37d0337"
  },
  "geometry": {
    "obj_path": "C:\\RIFT MODDING\\Assets\\Exports\\decode-nif-geometry-e3de1077a37d0337.json\\decode-nif-geometry-mesh6.obj",
    "mesh_block": "M#6",
    "mesh_size": 329,
    "vertex_count": 71,
    "face_count": 0,
    "has_faces": false,
    "render_class": "point-only",
    "obj_sha1": "c3095fc223fb5b9fa375ece7fc024b491ff5795c"
  },
  "world": {
    "world_json": "C:\\RIFT MODDING\\Assets\\Assets\\build\\flythrough\\objs\\worlds\\e3de1077a37d0337.world.json",
    "node_count": 1,
    "mesh_count": 2,
    "transform_semantics": "mesh-parent-chain",
    "coordinate_system": {
      "handedness": "right",
      "up_axis": "Y",
      "forward_axis": "-Z",
      "translation_layout": "xyz",
      "rotation_layout": "row-major-3x3",
      "scale_layout": "uniform-float",
      "trs_composition": "v_world = R * (S * v_local) + T",
      "identity_tolerance": 1e-06
    },
    "world_transform_summary": {
      "translation": [
        0,
        0,
        0
      ],
      "rotation": [
        1,
        0,
        0,
        0,
        1,
        0,
        0,
        0,
        1
      ],
      "scale": 1
    },
    "world_transform_identity": true
  },
  "materials": {
    "material_status": "textured",
    "texture_property_count": 0,
    "material_property_count": 0,
    "vertex_color_property_count": 0,
    "scanned_at": null,
    "notes": [
      "material_status=textured inferred from flythrough texture linkage (texture bindings confirmed by pipeline); not yet confirmed by NIF-level material property scan"
    ]
  },
  "textures": {
    "source": "flythrough",
    "linked_texture_count": 2,
    "linked_textures": [
      "40ea265b_sky_tg_cm_nebula_skygradient_01.png",
      "56c434ff_sky_tg_mt_sharax_nebula_01.png"
    ],
    "missing_texture_count": 0,
    "placeholder_texture_count": 0
  },
  "provenance": {
    "cohort": "C:\\RIFT MODDING\\Assets\\Assets\\Exports\\discovery-plan\\cycle-2\\stage1\\cohort.json",
    "source_nif_hash": "e3de1077a37d0337",
    "flythrough_index_entry": "C:\\RIFT MODDING\\Assets\\Assets\\build\\flythrough\\flythrough-index.json",
    "evidence_files": [
      "C:\\RIFT MODDING\\Assets\\Assets\\build\\flythrough\\objs\\worlds\\e3de1077a37d0337.world.json",
      "C:\\RIFT MODDING\\Assets\\Assets\\Exports\\discovery-plan\\cycle-2\\stage2\\transform-examples.json",
      "C:\\RIFT MODDING\\Assets\\Assets\\Exports\\discovery-plan\\cycle-2\\stage2\\coordinate-contract.md"
    ]
  },
  "validation": {
    "schema_valid": true,
    "consumer_ready": false,
    "warnings": [
      "face_count=0 (point-only asset) - no face data"
    ],
    "errors": []
  }
}