{
  "SchemaVersion": "scene-manifest/v1",
  "asset_id": "0631a80d1a32416b",
  "generated_at": "2026-06-16T13:18:36Z",
  "producer": {
    "tool": "scripts/build_scene_manifest.py",
    "version": "v0.7",
    "command": "python scripts/build_scene_manifest.py --asset-id 0631a80d1a32416b"
  },
  "geometry": {
    "obj_path": "C:\\RIFT MODDING\\Assets\\Exports\\decode-nif-geometry-0631a80d1a32416b.json\\decode-nif-geometry-mesh7.obj",
    "mesh_block": "M#7",
    "mesh_size": 325,
    "vertex_count": 20,
    "face_count": 18,
    "has_faces": true,
    "render_class": "faced",
    "obj_sha1": "6d55c790690fc0171f6a20c427897bce7d4e0220"
  },
  "world": {
    "world_json": "C:\\RIFT MODDING\\Assets\\Assets\\build\\flythrough\\objs\\worlds\\0631a80d1a32416b.world.json",
    "node_count": 2,
    "mesh_count": 2,
    "transform_semantics": "mesh-parent-chain",
    "coordinate_system": {
      "handedness": "right",
      "up_axis": "Y",
      "forward_axis": "-Z",
      "translation_layout": "xyz",
      "rotation_layout": "row-major-3x3",
      "scale_layout": "uniform-float",
      "trs_composition": "v_world = R * (S * v_local) + T",
      "identity_tolerance": 1e-06
    },
    "world_transform_summary": {
      "translation": [
        0,
        0,
        0
      ],
      "rotation": [
        1,
        0,
        0,
        0,
        1,
        0,
        0,
        0,
        1
      ],
      "scale": 1
    },
    "world_transform_identity": true
  },
  "materials": {
    "material_status": "textured",
    "texture_property_count": 0,
    "material_property_count": 0,
    "vertex_color_property_count": 0,
    "scanned_at": null,
    "notes": [
      "material_status=textured inferred from flythrough texture linkage (texture bindings confirmed by pipeline); not yet confirmed by NIF-level material property scan"
    ]
  },
  "textures": {
    "source": "flythrough",
    "linked_texture_count": 4,
    "linked_textures": [
      "1ca09027_h_m_dim_carpet_tiles_01_c_green.png",
      "2a1d70eb_h_m_dim_carpet_tiles_02_n_blue.png",
      "b110fb0c_h_m_dim_carpet_tiles_01_n_blue.png",
      "ce411f0d_h_m_dim_carpet_tiles_02_c_green.png"
    ],
    "missing_texture_count": 0,
    "placeholder_texture_count": 0
  },
  "provenance": {
    "cohort": "C:\\RIFT MODDING\\Assets\\Assets\\Exports\\discovery-plan\\cycle-2\\stage1\\cohort.json",
    "source_nif_hash": "0631a80d1a32416b",
    "flythrough_index_entry": "C:\\RIFT MODDING\\Assets\\Assets\\build\\flythrough\\flythrough-index.json",
    "evidence_files": [
      "C:\\RIFT MODDING\\Assets\\Assets\\build\\flythrough\\objs\\worlds\\0631a80d1a32416b.world.json",
      "C:\\RIFT MODDING\\Assets\\Assets\\Exports\\discovery-plan\\cycle-2\\stage2\\transform-examples.json",
      "C:\\RIFT MODDING\\Assets\\Assets\\Exports\\discovery-plan\\cycle-2\\stage2\\coordinate-contract.md"
    ]
  },
  "validation": {
    "schema_valid": true,
    "consumer_ready": true,
    "warnings": [],
    "errors": []
  }
}