{
  "SchemaVersion": "scene-manifest/v1",
  "asset_id": "0e0c61ad75d2af1e",
  "generated_at": "2026-06-16T17:25:31Z",
  "producer": {
    "tool": "scripts/build_scene_manifest.py",
    "version": "v0.8",
    "command": "python scripts/build_scene_manifest.py --asset-id 0e0c61ad75d2af1e"
  },
  "geometry": {
    "obj_path": "C:\\RIFT MODDING\\Assets\\Exports\\decode-nif-geometry-0e0c61ad75d2af1e.json\\decode-nif-geometry-mesh7.obj",
    "mesh_block": "M#7",
    "mesh_size": 193,
    "vertex_count": 56,
    "face_count": 54,
    "has_faces": true,
    "render_class": "faced",
    "obj_sha1": "6130f5af9ef1b3d940d2d452f486bd5def2a06a2"
  },
  "world": {
    "world_json": "C:\\RIFT MODDING\\Assets\\Assets\\build\\flythrough\\objs\\worlds\\0e0c61ad75d2af1e.world.json",
    "node_count": 1,
    "mesh_count": 1,
    "transform_semantics": "mesh-parent-chain",
    "coordinate_system": {
      "handedness": "right",
      "up_axis": "Y",
      "forward_axis": "-Z",
      "translation_layout": "xyz",
      "rotation_layout": "row-major-3x3",
      "scale_layout": "uniform-float",
      "trs_composition": "v_world = R * (S * v_local) + T",
      "identity_tolerance": 1e-06
    },
    "world_transform_summary": {
      "translation": [
        0,
        0,
        0
      ],
      "rotation": [
        1,
        0,
        0,
        0,
        1,
        0,
        0,
        0,
        1
      ],
      "scale": 1
    },
    "world_transform_identity": true
  },
  "materials": {
    "material_status": "material-or-vertex-color-only",
    "texture_property_count": 0,
    "material_property_count": 2,
    "vertex_color_property_count": 2,
    "scanned_at": "2026-06-16T17:19:54Z",
    "notes": [
      "material_status=material-or-vertex-color-only confirmed by NIF-level material property scan (NiTexturingProperty=0, NiMaterialProperty=2, NiVertexColorProperty=2, nif_version=20.6.0.0)"
    ]
  },
  "textures": {
    "source": "unknown",
    "linked_texture_count": 0,
    "linked_textures": [],
    "missing_texture_count": 0,
    "placeholder_texture_count": 0
  },
  "provenance": {
    "cohort": "C:\\RIFT MODDING\\Assets\\Assets\\Exports\\discovery-plan\\cycle-2\\stage1\\cohort.json",
    "source_nif_hash": "0e0c61ad75d2af1e",
    "flythrough_index_entry": "C:\\RIFT MODDING\\Assets\\Assets\\build\\flythrough\\flythrough-index.json",
    "evidence_files": [
      "C:\\RIFT MODDING\\Assets\\Assets\\build\\flythrough\\objs\\worlds\\0e0c61ad75d2af1e.world.json",
      "C:\\RIFT MODDING\\Assets\\Assets\\Exports\\discovery-plan\\cycle-2\\stage2\\transform-examples.json",
      "C:\\RIFT MODDING\\Assets\\Assets\\Exports\\discovery-plan\\cycle-2\\stage2\\coordinate-contract.md"
    ]
  },
  "validation": {
    "schema_valid": true,
    "consumer_ready": false,
    "warnings": [
      "textures.source=unknown - texture linkage not yet populated from any source"
    ],
    "errors": []
  }
}