{
  "SchemaVersion": "scene-manifest/v1",
  "asset_id": "8e01613d7ce9e297",
  "generated_at": "2026-06-16T17:25:29Z",
  "producer": {
    "tool": "scripts/build_scene_manifest.py",
    "version": "v0.8",
    "command": "python scripts/build_scene_manifest.py --asset-id 8e01613d7ce9e297"
  },
  "geometry": {
    "obj_path": "C:\\RIFT MODDING\\Assets\\Exports\\decode-nif-geometry-8e01613d7ce9e297.json\\decode-nif-geometry-mesh6.obj",
    "mesh_block": "M#6",
    "mesh_size": 329,
    "vertex_count": 93,
    "face_count": 0,
    "has_faces": false,
    "render_class": "point-only",
    "obj_sha1": "b0e467150fcc7d795de3a84b0978dcb032991910"
  },
  "world": {
    "world_json": "C:\\RIFT MODDING\\Assets\\Assets\\build\\flythrough\\objs\\worlds\\8e01613d7ce9e297.world.json",
    "node_count": 1,
    "mesh_count": 2,
    "transform_semantics": "mesh-parent-chain",
    "coordinate_system": {
      "handedness": "right",
      "up_axis": "Y",
      "forward_axis": "-Z",
      "translation_layout": "xyz",
      "rotation_layout": "row-major-3x3",
      "scale_layout": "uniform-float",
      "trs_composition": "v_world = R * (S * v_local) + T",
      "identity_tolerance": 1e-06
    },
    "world_transform_summary": {
      "translation": [
        0,
        0,
        0
      ],
      "rotation": [
        1,
        0,
        0,
        0,
        1,
        0,
        0,
        0,
        1
      ],
      "scale": 1
    },
    "world_transform_identity": true
  },
  "materials": {
    "material_status": "textured",
    "texture_property_count": 1,
    "material_property_count": 3,
    "vertex_color_property_count": 2,
    "scanned_at": "2026-06-16T17:19:54Z",
    "notes": [
      "material_status=textured confirmed by NIF-level material property scan (NiTexturingProperty=1, NiMaterialProperty=3, NiVertexColorProperty=2, nif_version=20.6.0.0)"
    ]
  },
  "textures": {
    "source": "flythrough",
    "linked_texture_count": 2,
    "linked_textures": [
      "085cfbbf_sky_lar_hod_skygradient_01.png",
      "abbc6318_sky_lar_nexus_cloud_skygradient_01.png"
    ],
    "missing_texture_count": 0,
    "placeholder_texture_count": 0
  },
  "provenance": {
    "cohort": "C:\\RIFT MODDING\\Assets\\Assets\\Exports\\discovery-plan\\cycle-2\\stage1\\cohort.json",
    "source_nif_hash": "8e01613d7ce9e297",
    "flythrough_index_entry": "C:\\RIFT MODDING\\Assets\\Assets\\build\\flythrough\\flythrough-index.json",
    "evidence_files": [
      "C:\\RIFT MODDING\\Assets\\Assets\\build\\flythrough\\objs\\worlds\\8e01613d7ce9e297.world.json",
      "C:\\RIFT MODDING\\Assets\\Assets\\Exports\\discovery-plan\\cycle-2\\stage2\\transform-examples.json",
      "C:\\RIFT MODDING\\Assets\\Assets\\Exports\\discovery-plan\\cycle-2\\stage2\\coordinate-contract.md"
    ]
  },
  "validation": {
    "schema_valid": true,
    "consumer_ready": false,
    "warnings": [
      "face_count=0 (point-only asset) - no face data"
    ],
    "errors": []
  }
}